{
  "requirement_hash": "a3c0ffee1234",
  "iteration": 0,
  "critic_session_id": "critique-a5-senior-qa-session",
  "weaknesses": [
    {
      "location": "generated/tests/a3-coupon.test.ts — 'applies numeric maximum_discount including zero'",
      "problem": "maximum_discount 검증이 정률 쿠폰에만 한정되어 정액 쿠폰에 숫자 한도가 지정된 경계를 놓친다.",
      "evidence": "REQ-A3-CAP은 쿠폰 종류를 제한하지 않고 계산된 할인액을 숫자 maximum_discount(0 포함)로 제한하라고 한다. 그러나 생성 테스트의 2000원 한도와 0원 한도 입력은 모두 discount_type: 'percentage'이다. 프로덕션 calculateCouponDiscount의 fixed 분기는 maximum_discount를 읽지 않고 Math.min(discountValue, safeSubtotal)만 반환하므로, 예를 들어 정액 5000원/소계 10000원/maximum_discount 2000원 결함을 현재 테스트가 통과시킨다.",
      "revision_direction": "정액 5000원, 소계 10000원, maximum_discount 2000원을 입력해 할인액 2000원을 기대하는 독립 Vitest와 대응 Gherkin 시나리오를 추가하고, maximum_discount 0인 정액 쿠폰도 할인액 0으로 검증한다."
    },
    {
      "location": "generated/features/a3-coupon.feature",
      "problem": "요구사항과 draft의 gherkin_scenarios에 정의된 네 가지 실패 흐름이 최종 Feature 파일에서 빠졌다.",
      "evidence": "초안 메타데이터에는 GH-A3-EMPTY, GH-A3-AUTH, GH-A3-LOOKUP, GH-A3-EXPIRED가 있고 REQ-A3-INPUT/LOOKUP을 각각 추적하지만, 생성 Feature에는 할인 계산 3개, 최소금액 2개, 사용자 한도 1개 시나리오만 있다. 따라서 빈 코드의 400 및 DB 0회, 비로그인의 401 및 DB 0회, 미존재 404, 만료 400과 정확한 실패 사유가 Cucumber 산출물에서는 검증되지 않는다.",
      "revision_direction": "누락된 네 시나리오를 Feature에 추가하고 각 Then에서 상태와 정확한 오류 문구를 고정한다. 빈 코드와 비로그인 시나리오는 DB 조회 횟수 0도 함께 고정한다."
    },
    {
      "location": "generated_files — generated/features/a3-coupon.feature",
      "problem": "Cucumber.js Feature에 대응하는 Step Definition 산출물이 없어 모든 단계가 undefined 상태다.",
      "evidence": "A3 generated_files에는 Vitest 파일과 .feature 파일만 있고 step-definition 종류의 파일이 없다. Feature가 사용하는 '상품 금액은 {int}원이다', '할인 금액을 계산하면', '쿠폰을 검증하면' 등의 단계는 현재 프로덕션 API에 자동 연결되지 않으므로 target_stack의 Cucumber.js로 실행할 수 없다.",
      "revision_direction": "시나리오별 새 World를 사용하는 Step Definition 파일을 생성한다. 계산 단계는 실제 calculateCouponDiscount를 호출하고, 검증 단계는 시나리오별 Supabase fake와 필요 시 고정 시각을 주입해 실제 validateCouponCode를 호출하며, 핵심 계산 함수는 mock하지 않는다."
    }
  ]
}
