{
  "requirement_hash": "a3c0ffee1234",
  "iteration": 2,
  "critic_session_id": "critique-a5-convergence-session",
  "weaknesses": [
    {
      "location": "generated/tests/a3-coupon.test.ts 및 generated/features/a3-coupon.feature — fixed maximum_discount 2000/0 행",
      "problem": "정액 쿠폰의 maximum_discount 기대값이 현재 프로덕션 구현과 직접 충돌해 테스트 스위트가 결정적으로 Green이 될 수 없다.",
      "evidence": "[실제 수렴 차단 문제] REQ-A3-CAP은 쿠폰 종류를 제한하지 않으므로 정액 5000원에 한도 2000원/0원을 기대하는 테스트 자체는 요구사항에 맞다. 그러나 프로덕션 calculateCouponDiscount의 fixed 분기는 maximum_discount를 읽지 않고 Math.min(discountValue, safeSubtotal)을 반환한다. 따라서 두 Vitest 행과 두 Cucumber 예시는 각각 기대 2000/0 대신 5000을 받아 항상 실패한다. 이는 사소한 테스트 표현 문제가 아니라 요구사항과 구현의 실제 불일치다.",
      "revision_direction": "테스트 기대값을 완화하지 말고 프로덕션 fixed 분기에도 maximum_discount의 null/undefined 구분과 0 포함 cap을 적용한다. 만약 최대 한도가 정률에만 적용되는 정책이라면 REQ-A3-CAP을 명시적으로 정률 전용으로 변경한 뒤 정액 행을 제거한다."
    },
    {
      "location": "generated/tests/a3-coupon.test.ts — 'rejects missing and expired coupons' 및 createCouponOrder happy-path 테스트",
      "problem": "미존재·만료 쿠폰이 결제에 적용되지 않는다는 요구를 검증 API 오류로만 대체해 결제·저장 부수효과 차단을 보장하지 않는다.",
      "evidence": "[실제 수렴 차단 문제] REQ-A3-LOOKUP은 두 쿠폰을 '결제에 적용할 수 없다'고 규정한다. 초안은 validateCouponCode의 404/400만 확인하고 createCouponOrder에서는 유효 쿠폰의 성공 경로만 실행한다. 현재 주문 서비스에는 CouponNotFoundError와 EXPIRED_COUPON 거절 경로가 있고 결제 및 저장 포트를 관찰할 수 있는데도, lookup 실패 시 paymentGateway.requestPayment와 orderRepository.save가 0회라는 assertion이 없다. 따라서 오류를 반환한 뒤 결제를 호출하는 회귀도 요구사항 충족으로 오판할 수 있다.",
      "revision_direction": "createCouponOrder에 couponRepository가 null을 반환하는 독립 테스트와 고정 now보다 expiresAt이 과거인 쿠폰 테스트를 추가한다. 각각 CouponNotFoundError 또는 CouponNotApplicableError의 EXPIRED_COUPON 사유를 검증하고 paymentGateway.requestPayment와 orderRepository.save가 호출되지 않았음을 assert한다."
    },
    {
      "location": "generated/steps/a3-coupon.steps.ts — clock 함수와 generated/cucumber.mjs",
      "problem": "고정 시각 구현이 globalThis.Date를 교체해 병렬 Cucumber 실행에서는 시나리오 간 간섭 가능성이 남는다.",
      "evidence": "[사소한 견고성 개선 — 현재 수렴 차단 아님] 제공된 cucumber.mjs는 parallel 값을 지정하지 않아 기본 직렬 실행에서는 try/finally 복원으로 재현 가능하다. 다만 clock은 World 인스턴스가 아니라 프로세스 전역 Date를 바꾸고 비동기 validateCouponCode 동안 유지하므로, 추후 --parallel을 켜면 서로 다른 시나리오의 시각과 복원 순서가 충돌할 수 있다. 현재 요구사항 사례의 정확성이나 기본 실행의 수렴을 막는 결함은 아니다.",
      "revision_direction": "현재 API에 시계 주입점이 없는 동안 cucumber.mjs에 parallel: 0을 명시해 직렬 실행 계약을 고정한다. 장기적으로 validateCouponCode에 now 또는 Clock 의존성을 주입해 각 World가 자체 시각을 보유하도록 바꾸면 전역 Date 대체를 제거할 수 있다."
    }
  ]
}
